{
  "artifact_name": "publication_readiness_eval",
  "schema_version": "20260615_v3",
  "run_id": "RUN_DHG_20260615_V3",
  "ticker": "DHG",
  "snapshot_id": "SNAP_DHG_FY2022_2025_V3",
  "status": "APPROVED_FOR_EXPORT",
  "summary": {
    "metric_count": 5
  },
  "metrics": [
    {
      "metric_id": "publication.package_validation_passed",
      "metric_name": "Package validation passed",
      "category": "publication_readiness",
      "layer": "release_gate",
      "metric_type": "boolean",
      "scope": "report_run",
      "severity": "P0",
      "blocks_publish": true,
      "threshold_operator": "=",
      "threshold": true,
      "unit": "boolean",
      "owner": "governance",
      "remediation_hint": "Fix package gate blockers.",
      "value": true,
      "status": "pass",
      "sample_size": 1,
      "failed_examples": [],
      "artifact_id": null,
      "artifact_version": "v3",
      "dataset_version": "20260615_v3",
      "benchmark_suite_version": "20260615_v3",
      "evaluated_at": "2026-06-15T00:00:00Z"
    },
    {
      "metric_id": "publication.report_quality_allow_export",
      "metric_name": "Report quality allow_export",
      "category": "publication_readiness",
      "layer": "release_gate",
      "metric_type": "boolean",
      "scope": "report_run",
      "severity": "P0",
      "blocks_publish": true,
      "threshold_operator": "=",
      "threshold": true,
      "unit": "boolean",
      "owner": "governance",
      "remediation_hint": "Report quality decision must allow export.",
      "value": true,
      "status": "pass",
      "sample_size": 1,
      "failed_examples": [],
      "artifact_id": null,
      "artifact_version": "v3",
      "dataset_version": "20260615_v3",
      "benchmark_suite_version": "20260615_v3",
      "evaluated_at": "2026-06-15T00:00:00Z"
    },
    {
      "metric_id": "publication.publishable_model_locked",
      "metric_name": "Publishable model locked",
      "category": "publication_readiness",
      "layer": "release_gate",
      "metric_type": "boolean",
      "scope": "report_run",
      "severity": "P0",
      "blocks_publish": true,
      "threshold_operator": "=",
      "threshold": true,
      "unit": "boolean",
      "owner": "governance",
      "remediation_hint": "Promote and lock publishable_final_report_model.",
      "value": true,
      "status": "pass",
      "sample_size": 1,
      "failed_examples": [],
      "artifact_id": null,
      "artifact_version": "v3",
      "dataset_version": "20260615_v3",
      "benchmark_suite_version": "20260615_v3",
      "evaluated_at": "2026-06-15T00:00:00Z"
    },
    {
      "metric_id": "publication.snapshot_match",
      "metric_name": "Report and valuation snapshot match",
      "category": "publication_readiness",
      "layer": "release_gate",
      "metric_type": "boolean",
      "scope": "report_run",
      "severity": "P0",
      "blocks_publish": true,
      "threshold_operator": "=",
      "threshold": true,
      "unit": "boolean",
      "owner": "governance",
      "remediation_hint": "Rebuild report using valuation snapshot.",
      "value": true,
      "status": "pass",
      "sample_size": 1,
      "failed_examples": [],
      "artifact_id": null,
      "artifact_version": "v3",
      "dataset_version": "20260615_v3",
      "benchmark_suite_version": "20260615_v3",
      "evaluated_at": "2026-06-15T00:00:00Z"
    },
    {
      "metric_id": "publication.final_approval_present",
      "metric_name": "Final approval present",
      "category": "publication_readiness",
      "layer": "release_gate",
      "metric_type": "boolean",
      "scope": "report_run",
      "severity": "P0",
      "blocks_publish": true,
      "threshold_operator": "=",
      "threshold": true,
      "unit": "boolean",
      "owner": "reviewer",
      "remediation_hint": "Obtain final_report approval before client-final.",
      "value": true,
      "status": "pass",
      "sample_size": 1,
      "failed_examples": [],
      "artifact_id": null,
      "artifact_version": "v3",
      "dataset_version": "20260615_v3",
      "benchmark_suite_version": "20260615_v3",
      "evaluated_at": "2026-06-15T00:00:00Z"
    }
  ],
  "top_blockers": [],
  "artifact_refs": {
    "manifest": "runs/RUN_DHG_20260615_V3/manifest.json"
  }
}