{
  "artifact_name": "financial_eval",
  "schema_version": "20260615_v3",
  "run_id": "RUN_DHG_20260615_V3",
  "ticker": "DHG",
  "snapshot_id": "SNAP_DHG_FY2022_2025_V3",
  "status": "PASS",
  "summary": {
    "metric_count": 6
  },
  "metrics": [
    {
      "metric_id": "finance.accounting_invariant_violations",
      "metric_name": "Accounting invariant violations",
      "category": "financial_model",
      "layer": "release_gate",
      "metric_type": "error_count",
      "scope": "report_run",
      "severity": "P0",
      "blocks_publish": true,
      "threshold_operator": "=",
      "threshold": 0,
      "unit": "count",
      "owner": "valuation",
      "remediation_hint": "Fix balance sheet, cash flow, unit or sign convention.",
      "value": 0,
      "status": "pass",
      "sample_size": 20,
      "failed_examples": [],
      "artifact_id": null,
      "artifact_version": "v3",
      "dataset_version": "20260615_v3",
      "benchmark_suite_version": "20260615_v3",
      "evaluated_at": "2026-06-15T00:00:00Z"
    },
    {
      "metric_id": "finance.share_count_mismatch",
      "metric_name": "Share count mismatch",
      "category": "financial_model",
      "layer": "release_gate",
      "metric_type": "error_count",
      "scope": "report_run",
      "severity": "P0",
      "blocks_publish": true,
      "threshold_operator": "=",
      "threshold": 0,
      "unit": "count",
      "owner": "valuation",
      "remediation_hint": "Use diluted shares consistently in EPS and target price.",
      "value": 0,
      "status": "pass",
      "sample_size": 1,
      "failed_examples": [],
      "artifact_id": null,
      "artifact_version": "v3",
      "dataset_version": "20260615_v3",
      "benchmark_suite_version": "20260615_v3",
      "evaluated_at": "2026-06-15T00:00:00Z"
    },
    {
      "metric_id": "finance.target_price_bridge_error",
      "metric_name": "Target price bridge error",
      "category": "financial_model",
      "layer": "release_gate",
      "metric_type": "error_count",
      "scope": "report_run",
      "severity": "P0",
      "blocks_publish": true,
      "threshold_operator": "=",
      "threshold": 0,
      "unit": "count",
      "owner": "valuation",
      "remediation_hint": "Rebuild EV-to-equity and shares bridge.",
      "value": 0,
      "status": "pass",
      "sample_size": 1,
      "failed_examples": [],
      "artifact_id": null,
      "artifact_version": "v3",
      "dataset_version": "20260615_v3",
      "benchmark_suite_version": "20260615_v3",
      "evaluated_at": "2026-06-15T00:00:00Z"
    },
    {
      "metric_id": "finance.wacc_terminal_growth_violation",
      "metric_name": "WACC terminal growth violation",
      "category": "financial_model",
      "layer": "release_gate",
      "metric_type": "error_count",
      "scope": "report_run",
      "severity": "P0",
      "blocks_publish": true,
      "threshold_operator": "=",
      "threshold": 0,
      "unit": "count",
      "owner": "valuation",
      "remediation_hint": "Ensure discount rate is greater than terminal growth.",
      "value": 0,
      "status": "pass",
      "sample_size": 1,
      "failed_examples": [],
      "artifact_id": null,
      "artifact_version": "v3",
      "dataset_version": "20260615_v3",
      "benchmark_suite_version": "20260615_v3",
      "evaluated_at": "2026-06-15T00:00:00Z"
    },
    {
      "metric_id": "finance.net_debt_reconciliation_error",
      "metric_name": "Net debt reconciliation error",
      "category": "financial_model",
      "layer": "release_gate",
      "metric_type": "error_count",
      "scope": "report_run",
      "severity": "P0",
      "blocks_publish": true,
      "threshold_operator": "=",
      "threshold": 0,
      "unit": "count",
      "owner": "valuation",
      "remediation_hint": "Recompute interest-bearing debt minus cash/ST investments.",
      "value": 0,
      "status": "pass",
      "sample_size": 1,
      "failed_examples": [],
      "artifact_id": null,
      "artifact_version": "v3",
      "dataset_version": "20260615_v3",
      "benchmark_suite_version": "20260615_v3",
      "evaluated_at": "2026-06-15T00:00:00Z"
    },
    {
      "metric_id": "finance.valuation_publishability",
      "metric_name": "Valuation publishability",
      "category": "financial_model",
      "layer": "release_gate",
      "metric_type": "boolean",
      "scope": "report_run",
      "severity": "P0",
      "blocks_publish": true,
      "threshold_operator": "=",
      "threshold": true,
      "unit": "boolean",
      "owner": "valuation",
      "remediation_hint": "Publish only selected methods with valid formula trace and inputs.",
      "value": true,
      "status": "pass",
      "sample_size": 1,
      "failed_examples": [],
      "artifact_id": null,
      "artifact_version": "v3",
      "dataset_version": "20260615_v3",
      "benchmark_suite_version": "20260615_v3",
      "evaluated_at": "2026-06-15T00:00:00Z"
    }
  ],
  "top_blockers": [],
  "artifact_refs": {
    "manifest": "runs/RUN_DHG_20260615_V3/manifest.json"
  }
}